{
  "contractVersion": "1.0.0",
  "skill": {"name": "secret-audit", "version": "0.2.3"},
  "invocation": {
    "id": "example-secret-audit",
    "startedAt": "2026-07-03T11:00:00Z",
    "endedAt": "2026-07-03T11:01:00Z"
  },
  "repository": {
    "root": "/workspace/example-project",
    "branch": "main",
    "head": "0123456789abcdef",
    "workingTreeState": "clean"
  },
  "userIntent": "Find possible tracked secret exposure before handoff.",
  "declaredScope": ["/workspace/example-project"],
  "projectAdapter": "example-secret-adapter",
  "environmentSummary": {"platform": "linux", "shell": "bash"},
  "status": "complete",
  "confidence": {
    "level": "high",
    "reason": "Static files were scanned for high-confidence secret-like patterns with matched values omitted."
  },
  "commands": [
    {
      "command": "coding-agent-skills secret-audit /workspace/example-project",
      "family": "secret-audit-renderer",
      "workingDirectory": "/workspace/example-project",
      "startedAt": "2026-07-03T11:00:20Z",
      "endedAt": "2026-07-03T11:00:21Z",
      "exitStatus": 0,
      "resultStatus": "success",
      "safetyClass": "allowed",
      "approvalReference": null,
      "purpose": "Render a redacted static secret-audit report.",
      "outputSummary": "Reported finding paths, types, and counts without matched values."
    }
  ],
  "skippedChecks": [],
  "findings": [
    {
      "summary": "Potential secret exposure was reported by file path, type, and count only.",
      "evidence": ["src/example.ts"]
    }
  ],
  "risks": [],
  "failures": [],
  "unresolvedQuestions": [],
  "changedState": {
    "changed": false,
    "summary": "No project, Git, dependency, runtime, service, or remote state changed."
  },
  "handoffSummary": "Secret-like findings require human review; matched values were omitted.",
  "recommendedNextAction": "Review flagged files locally and rotate credentials only through approved project procedures."
}
